{
  "schema_version": "0.1",
  "producer": "team2",
  "timestamp": "2026-10-25T10:01:05.000Z",
  "seq": 12,
  "frame_id": "robot_base",
  "valid": true,
  "robot": {
    "robot_state": "idle",
    "joint_names": [
      "joint_a1",
      "joint_a2",
      "joint_a3",
      "joint_a4",
      "joint_a5",
      "joint_a6"
    ],
    "joint_positions_rad": [0.0, -0.5, 0.8, 0.0, 0.6, 0.0],
    "tcp_position_m": [0.442, -0.0525, 0.835],
    "tcp_orientation_xyzw": [0.0, 0.7071, 0.0, 0.7071]
  },
  "fixture": {
    "state": "locked",
    "angle_rad": 0.0
  },
  "clamps": {
    "state": "locked"
  },
  "process": {
    "welding_active": false,
    "current_A": null,
    "voltage_V": null,
    "travel_speed_m_s": null
  },
  "safety": {
    "plc_ok": true,
    "estop_active": false,
    "faults": []
  },
  "last_command": {
    "decision_id": "cmd_0001",
    "status": "completed",
    "message": "simulation command completed"
  }
}
